Title,Links,Date
5 Topics To Master Before Learning React Hooks ,/blog/five-topics-to-master-before-learning-react-hooks,2020-07-28 16:42:26 UTC
What You Can Learn From Learning A New Language,/blog/what-you-can-learn-from-learning-a-new-language,2020-07-21 23:30:32 UTC
Software Engineering Careers Post Covid-19,/blog/software-engineering-coronavirus-job-market,2020-07-08 22:58:21 UTC
What Coding Language You Should Learn To Get Hired In 2020,/blog/what-coding-language-you-should-learn-to-get-hired-in-2020,2020-07-02 01:56:44 UTC
Alumni Spotlight: George Gruner,/blog/alumni-spotlight-george-gruner,2020-06-24 22:29:08 UTC
A Tech Worker Reading List for 2020,/blog/tech-worker-reading-list-for-2020,2020-06-08 19:07:59 UTC
JavaScript in 2020,/blog/javascript-in-2020,2020-05-27 21:40:51 UTC
Rithm's Alumni Mentor Program,/blog/bootcamp-alumni-mentorship-program,2020-05-12 22:36:35 UTC
Rithm School Remote Updates - Scholarships & Smaller Class Sizes,/blog/remote-2020-updates-scholarships,2020-05-06 18:03:43 UTC
Student Interview: R14 On Remote Company Projects,/blog/student-interview-remote-company-projects,2020-04-29 18:33:49 UTC
7 Easy Ways To Focus On The Job Search Process,/blog/focus-job-process-during-covid-19,2020-04-21 20:34:41 UTC
SanFranciscoBootcamps.com - Campus Review – Rithm School San Francisco,/blog/san-francisco-coding-bootcamps-review,2020-04-08 21:17:19 UTC
Rithm School Remote Learning FAQs,/blog/remote-learning-faq,2020-04-01 00:00:00 UTC
Looking Back On Our First Women In Tech Event Series ,/blog/looking-back-women-in-tech,2020-03-31 17:01:40 UTC
Working From Home: A Guide to Success,/blog/working-from-home-guide-to-success,2020-03-16 21:59:56 UTC
How To Get Good At Coding Challenges,/blog/how-to-get-good-at-coding-challenges,2020-03-04 21:47:44 UTC
Avoid Recruiters: Embrace Cold Email,/blog/avoid-recruiters-use-cold-email,2020-02-26 17:19:36 UTC
4 Strategies for Whiteboarding Success,/blog/strategies-for-whiteboarding,2020-02-16 17:12:40 UTC
8 Questions You Should Consider Before Becoming A Software Engineer,/blog/introduction-to-software-engineering,2020-02-13 20:07:09 UTC
Intro To Modern React - Preview,/blog/intro-to-modern-react-preivew,2020-02-05 17:18:59 UTC
